{
  "$schema": "https://json-schema.org/draft/2020-12/schema",
  "title": "SkillTimeline",
  "type": "object",
  "required": ["formatVersion", "skillId", "duration", "characterAnimation", "tracks"],
  "properties": {
    "formatVersion": { "const": 1 },
    "skillId": { "type": "string", "minLength": 1 },
    "displayName": { "type": "string" },
    "duration": { "type": "number", "minimum": 0.01 },
    "characterProfileId": { "type": "string" },
    "characterAnimation": { "type": "string", "minLength": 1 },
    "tracks": {
      "type": "array",
      "items": { "$ref": "#/$defs/track" }
    }
  },
  "$defs": {
    "track": {
      "type": "object",
      "required": ["trackId", "type", "clips"],
      "properties": {
        "trackId": { "type": "string" },
        "type": { "enum": ["character", "fx", "hitbox", "shader", "event"] },
        "displayName": { "type": "string" },
        "clips": { "type": "array", "items": { "$ref": "#/$defs/clip" } }
      }
    },
    "clip": {
      "type": "object",
      "required": ["clipId", "start", "payload"],
      "properties": {
        "clipId": { "type": "string" },
        "start": { "type": "number", "minimum": 0 },
        "end": { "type": "number", "minimum": 0 },
        "payload": { "type": "object" }
      }
    }
  }
}
